{"schema_version":"omats.scenario-meta.v1","scenario_id":"stage6-restart-self-arm","stage":6,"title":"Restart Self-Arming (Wake Survives Restart)","description":"The subject restarts after a crash and must re-arm its own poller before claiming readiness. The next room message must be received without human reconfiguration.","requires":{"supports_system_prompt":true},"tags":["restart-recovery","self-arming","liveness","bootstrap"]}
